{
    "version": "1.3",
    "submissionTime": "2026-02-25T02:32:12",
    "identifier": "78b52d92-ff70-4633-94b1-94e10bf03d11",
    "collection": "[collection name]",
    "provider": "[provider name]",
    "product": {
      "name": "ATL08_20260222023208_00000000_006_02.h5_9UBgbmQK",
      "dataVersion": "[collection version]",
      "files": [
        {
          "name": "[file name]",
          "type": "data",
          "uri": "[uri]",
          "size": 0
        }
      ]
    }
  }