{
  "version":"1.1",
  "provider": "PODAAC_SWOT",
  "collection": "SWOT_Prod_l2:1",
  "submissionTime":"2017-09-30T03:42:29.791198Z",
  "identifier": "1234-abcd-efg0-9876",
  "product":
    {
      "name": "sampleGranuleName001",
      "dataVersion": "001",
      "filegroups" : [{
        "id" : "filgroup1",
        "files": [
          {
            "type": "data",
            "uri": "s3://sampleIngestBucket/prod_20170926T11:30:36/production_file1.nc",
            "name":"production_file1.nc",
            "checksumType": "md5",
            "checksum": "4241jafkjaj14jasjf",
            "size": 123456
          },
          {
            "type": "browse",
            "uri": "s3://sampleIngestBucket/prod_20170926T11:30:36/production_file1.png",
            "name":"production_file1.png",
            "checksumType": "md5",
            "checksum": "addjd872342bfbf",
            "size": 12345
          }
        ]
      },
      {
        "id" : "filgroup2",
        "files": [
          {
            "type": "data",
            "uri": "s3://sampleIngestBucket/prod_20170926T11:30:36/production_file2.nc",
            "name":"production_file2.nc",
            "checksumType": "md5",
            "checksum": "54241jafkjaj14jasjf",
            "size": 223456
          },
          {
            "type": "browse",
            "uri": "s3://sampleIngestBucket/prod_20170926T11:30:36/production_file2.png",
            "name":"production_file2.png",
            "checksumType": "md5",
            "checksum": "aaddjd872342bfbf",
            "size": 22345
          }
        ]
      }]
   }
}
