{
  "version":"1.0",
  "provider": "PODAAC_SWOT",
  "collection": "SWOT_Prod_l2:1",
  "submissionTime":"2017-09-30T03:42:29.791198Z",
  "identifier": "1234-abcd-efg0-9876",
  "product":
    {
      "name": "/myPath/mypath1/mypath2/OPS_granule_L2_GLA_H_20220101T000000_20220101T001500_0001.nc",
      "dataVersion": "001",
      "files": [
        {
          "type": "data",
          "uri": "s3://sampleIngestBucket/prod_20170926T11:30:36/OPS_granule_L2_GLA_H_20220101T000000_20220101T001500_0001.nc",
          "name":"OPS_granule_L2_GLA_H_20220101T000000_20220101T001500_0001.nc",
          "checksumType": "md5",
          "checksum": "4241jafkjaj14jasjf",
          "size": 823456
        },
        {
          "type": "browse",
          "uri": "s3://sampleIngestBucket/prod_20170926T11:30:36/OPS_granule_L2_GLA_H_20220101T000000_20220101T001500_0001.png",
          "name":"OPS_granule_L2_GLA_H_20220101T000000_20220101T001500_0001.png",
          "checksumType": "md5",
          "checksum": "addjd872342bfbf",
          "size": 73456
        }
      ]
    }
}
